{
  "case_slug": "pancreatic-mets-kras-g12d-basal-arid1a-k9r3",
  "efficacy_toxicity_weight": 0.5,
  "toxicity_vetoes": [],
  "modality_constraints": [],
  "free_text_constraints": "Case presented with a rich molecular profile but no stated patient preferences or goals-of-care. CONFIRMED-BIOMARKER CASE: all findings come from Tempus xF (plasma ctDNA), xG (germline: none), xR (rearrangements: none), the PurIST RNA signature (basal-like), and HLA typing, so this is a single unbranched ranking scoped to feature-targeting interventions, not a biomarker-gated branched case. Lead targetable axis is KRAS G12D (small-molecule RAS(ON) inhibitors plus KRAS-directed vaccine/T-cell therapy), with ARID1A loss as a secondary synthetic-lethal axis. KEY CLINICAL JUDGMENT CALLS for downstream agents to honor: (1) MLH1 mutation sits in an MSS, TMB-8.6, germline-negative context and most likely reflects MMR-proficient biology; treat checkpoint-inhibitor monotherapy as low-yield and surface MMR IHC as the validation gate before any dMMR/MSI-H immunotherapy claim. (2) The patient is HLA-C*05:01/C*06:02, NOT C*08:02, so the published HLA-C*08:02-restricted anti-KRAS-G12D TCR-T does not apply; screen each KRAS immunotherapy against the patient's actual class I alleles (A*01:01, A*02:01, B*37:01, B*44:02, C*05:01, C*06:02). (3) The ASXL1 frameshift in plasma may be clonal hematopoiesis rather than tumor; flag for paired blood-cell confirmation, do not treat as a tumor target. ASSUMPTIONS (flag to treating team): ECOG 1 assumed (performance status not supplied and is decision-critical in a 79-year-old); geography defaulted to US; efficacy/toxicity weight set to a neutral 0.5 since no preference was stated, though age 79 may warrant a more toxicity-averse weighting; no prior therapies recorded (treatment-naive assumed from a newly-diagnosed presentation). Re-run intake if performance status, goals-of-care, or a preferred efficacy/toxicity balance become available; the ranking and the willingness to surface aggressive trial-only options would shift accordingly.",
  "prefers_trials": true
}
